{
  "schemaVersion": 1,
  "capturedAt": "2026-09-18T12:11:18.380Z",
  "trackedFiles": 7696,
  "classifiedFiles": 7696,
  "unclassifiedFiles": [],
  "unclassifiedTruncated": false,
  "classificationCounts": {
    "touchesGeneratedOutput": 131,
    "touchesConfiguration": 944,
    "touchesDocumentationOnly": 1728,
    "touchesInfrastructure": 88,
    "touchesApplicationUI": 5502,
    "touchesReference": 1,
    "touchesQualification": 927,
    "touchesHarness": 31,
    "touchesPolicies": 44
  },
  "notes": [
    "100% coverage achieved — rules hit every tracked file."
  ]
}